{
  "$schema": "https://json-schema.org/draft/2020-12/schema",
  "$id": "https://civil-aviation-doc-audit.local/schemas/rule-schema.json",
  "title": "民航施工资料审核规则（单条）",
  "description": "校验单条规则 JSON 文件。参考 spec.md 第 5.1 / 5.2 节。",
  "type": "object",
  "required": [
    "rule_id",
    "name",
    "level",
    "scope",
    "trigger_when",
    "check_expr",
    "error_template",
    "status",
    "source",
    "version",
    "created_at",
    "updated_at",
    "changelog"
  ],
  "properties": {
    "rule_id": {
      "type": "string",
      "pattern": "^[A-Z]+-[A-Z0-9-]+$",
      "description": "全局唯一规则 ID，如 R-001 / LG-001 / BZ-001 / CU-001 / BZ-CUSTOM-001 / CU-INC-2026-07-30-001"
    },
    "name": {
      "type": "string",
      "minLength": 1,
      "description": "规则名称"
    },
    "level": {
      "type": "string",
      "enum": ["L1-IRON", "L2-LOGIC", "L3-BUSINESS"],
      "description": "规则层级：L1 铁律 / L2 逻辑一致性 / L3 业务合理性"
    },
    "scope": {
      "type": "string",
      "enum": ["SINGLE_DOC", "CROSS_DOC", "CROSS_UNIT"],
      "description": "作用域：单资料 / 跨资料 / 跨单位"
    },
    "category": {
      "type": "string",
      "description": "可选分类标签，如 数学自洽 / 跨单位数量对照"
    },
    "description": {
      "type": "string",
      "description": "规则的人类可读说明"
    },
    "trigger_when": {
      "type": "object",
      "properties": {
        "doc_type": {
          "type": "array",
          "items": {"type": "string", "minLength": 1},
          "description": "单资料/跨资料作用域下触发的资料类型列表"
        },
        "doc_type_a": {
          "type": "string",
          "description": "跨单位作用域下甲方资料类型"
        },
        "doc_type_b": {
          "type": "string",
          "description": "跨单位作用域下乙方资料类型"
        },
        "require_both": {
          "type": "boolean",
          "description": "跨单位作用域下是否要求双方资料同时存在才触发"
        },
        "field_required": {
          "type": "array",
          "items": {"type": "string", "minLength": 1},
          "description": "触发所需字段列表"
        }
      },
      "additionalProperties": true
    },
    "check_expr": {
      "type": "object",
      "required": ["type", "expr"],
      "properties": {
        "type": {
          "type": "string",
          "enum": ["expression", "cross_compare", "aggregation"],
          "description": "校验表达式类型"
        },
        "language": {
          "type": "string",
          "description": "表达式语言，如 jinja-expr / python_eval"
        },
        "expr": {
          "type": "string",
          "minLength": 1,
          "description": "校验表达式本体"
        },
        "fallback": {
          "type": "string",
          "description": "主表达式失败时的回退求值方式"
        }
      },
      "additionalProperties": true
    },
    "error_template": {
      "type": "string",
      "minLength": 1,
      "description": "错误消息模板，含 {占位符}"
    },
    "severity_on_violation": {
      "type": "string",
      "enum": ["Fatal", "Sanity Check", "Best Practice"],
      "description": "违反后果严重度"
    },
    "remediation": {
      "type": "string",
      "description": "整改建议"
    },
    "status": {
      "type": "string",
      "enum": ["draft", "testing", "active", "incubating", "deprecated", "pending_confirmation"],
      "description": "规则生命周期状态"
    },
    "source": {
      "type": "string",
      "enum": ["system", "custom", "incubated"],
      "description": "规则来源"
    },
    "version": {
      "type": "string",
      "pattern": "^\\d+\\.\\d+\\.\\d+$",
      "description": "语义化版本号 X.Y.Z"
    },
    "created_at": {
      "type": "string",
      "pattern": "^\\d{4}-\\d{2}-\\d{2}(T\\d{2}:\\d{2}:\\d{2})?(Z|[+-]\\d{2}:\\d{2})?$",
      "description": "创建时间，ISO 8601"
    },
    "updated_at": {
      "type": "string",
      "pattern": "^\\d{4}-\\d{2}-\\d{2}(T\\d{2}:\\d{2}:\\d{2})?(Z|[+-]\\d{2}:\\d{2})?$",
      "description": "更新时间，ISO 8601"
    },
    "owner": {
      "type": "string",
      "description": "规则归属者"
    },
    "applies_to": {
      "type": "object",
      "properties": {
        "professional": {
          "type": "array",
          "items": {"type": "string"}
        },
        "subdivision_codes": {
          "type": "array",
          "items": {"type": "string"}
        }
      },
      "additionalProperties": true
    },
    "stats": {
      "type": "object",
      "properties": {
        "total_hits": {"type": "integer", "minimum": 0},
        "total_reviews": {"type": "integer", "minimum": 0},
        "hit_rate": {"type": "number", "minimum": 0},
        "false_positive_count": {"type": "integer", "minimum": 0},
        "false_positive_rate": {"type": "number", "minimum": 0},
        "last_hit_at": {
          "type": ["string", "null"],
          "pattern": "^\\d{4}-\\d{2}-\\d{2}(T\\d{2}:\\d{2}:\\d{2})?(Z|[+-]\\d{2}:\\d{2})?$"
        },
        "last_review_at": {
          "type": ["string", "null"],
          "pattern": "^\\d{4}-\\d{2}-\\d{2}(T\\d{2}:\\d{2}:\\d{2})?(Z|[+-]\\d{2}:\\d{2})?$"
        }
      },
      "additionalProperties": true
    },
    "alignment": {
      "type": ["object", "null"],
      "description": "跨单位数据对齐配置；scope=CROSS_UNIT 时必填且非 null",
      "properties": {
        "party_a": {
          "type": "object",
          "required": ["role", "doc_type"],
          "properties": {
            "role": {"type": "string"},
            "label": {"type": "string"},
            "doc_type": {"type": "string"}
          },
          "additionalProperties": true
        },
        "party_b": {
          "type": "object",
          "required": ["role", "doc_type"],
          "properties": {
            "role": {"type": "string"},
            "label": {"type": "string"},
            "doc_type": {"type": "string"}
          },
          "additionalProperties": true
        },
        "join_key": {
          "type": "array",
          "items": {"type": "string"},
          "minItems": 1
        },
        "field_a": {"type": "string"},
        "field_b": {"type": "string"},
        "aggregation": {"type": "string"}
      },
      "additionalProperties": true
    },
    "confirmation_required": {
      "type": "boolean",
      "description": "是否需要协同确认；跨单位规则应为 true"
    },
    "confirmation_scope": {
      "type": "string",
      "description": "协同确认范围，如 both_parties_or_admin"
    },
    "effective_scope": {
      "type": "string",
      "enum": ["global", "project"],
      "description": "生效范围：global=全局生效（默认）；project=仅 project_scope 列出的项目生效。B-4.4"
    },
    "project_scope": {
      "type": "array",
      "items": {"type": "string", "minLength": 1},
      "description": "项目级生效的项目名列表；仅 effective_scope=project 时有效。B-4.4"
    },
    "changelog": {
      "type": "array",
      "items": {
        "type": "object",
        "required": ["version", "date", "author", "change"],
        "properties": {
          "version": {"type": "string"},
          "date": {"type": "string"},
          "author": {"type": "string"},
          "change": {"type": "string"}
        },
        "additionalProperties": true
      }
    }
  },
  "allOf": [
    {
      "if": {
        "properties": {"scope": {"const": "CROSS_UNIT"}},
        "required": ["scope"]
      },
      "then": {
        "required": ["alignment"],
        "properties": {
          "alignment": {"type": "object"},
          "confirmation_required": {"const": true},
          "trigger_when": {
            "required": ["doc_type_a", "doc_type_b"]
          }
        }
      }
    },
    {
      "if": {
        "not": {
          "properties": {"scope": {"const": "CROSS_UNIT"}},
          "required": ["scope"]
        }
      },
      "then": {
        "properties": {
          "trigger_when": {
            "required": ["doc_type"]
          }
        }
      }
    }
  ]
}
