{
  "rule_id": "IR-014",
  "name": "多参数联检",
  "level": "L2-LOGIC",
  "scope": "SINGLE_DOC",
  "category": "数学自洽",
  "description": "实长/灌入量/充盈系数同时校验才能发现造假。三条工程逻辑链：实长=桩顶高程−桩底高程、充盈系数=灌入量/(π×(桩径/2)²×实长)、灌入量≈理论体积×充盈系数。任意一条不通过标记 DQ-ALTER，两条及以上不通过视为造假嫌疑建议现场取芯。多参数联合校验。从铁律 R-14 迁移并修正层级（原错归 L1，实际为 L2 数学自洽）。",
  "trigger_when": {
    "doc_type": [
      "碎石桩施工记录",
      "PHC管桩施工记录"
    ],
    "field_required": [
      "实长",
      "灌入量",
      "充盈系数"
    ]
  },
  "check_expr": {
    "type": "expression",
    "expr": "True",
    "language": "python_eval"
  },
  "error_template": "多参数联检失败：{issue}",
  "severity_on_violation": "Fatal",
  "remediation": "核查关联参数是否被涂改；两条以上链不通过建议现场取芯验证",
  "status": "active",
  "source": "system",
  "version": "1.0.0",
  "created_at": "2026-07-30T10:00:00",
  "updated_at": "2026-07-30T10:00:00",
  "owner": "system",
  "applies_to": {
    "professional": [
      "*"
    ],
    "subdivision_codes": []
  },
  "stats": {
    "total_hits": 0,
    "total_reviews": 0,
    "hit_rate": 0.0,
    "false_positive_count": 0,
    "false_positive_rate": 0.0,
    "last_hit_at": null,
    "last_review_at": null
  },
  "alignment": null,
  "changelog": [
    {
      "version": "1.0.0",
      "date": "2026-07-30",
      "author": "system",
      "change": "从 SKILL.md 铁律 R-14 迁移并修正层级（从 L1-IRON 修正为 L2-LOGIC 数学自洽）"
    }
  ]
}