{
  "rule_id": "CU-017",
  "name": "第一次工地会议纪要日期 ≤ 开工日期",
  "level": "L2-LOGIC",
  "scope": "CROSS_UNIT",
  "category": "跨单位日期对照",
  "description": "第一次工地会议召开日期 ≤ 工程开工日期。会议纪要日期标志着监理工作正式启动，应在开工之前。开工日期早于第一次工地会议日期（先开工后开会）为矛盾",
  "trigger_when": {
    "doc_type_a": "第一次工地会议纪要",
    "doc_type_b": "开工报审表",
    "require_both": true
  },
  "alignment": {
    "party_a": {
      "role": "supervisor",
      "label": "监理方",
      "doc_type": "第一次工地会议纪要"
    },
    "party_b": {
      "role": "contractor",
      "label": "施工方",
      "doc_type": "开工报审表"
    },
    "join_key": ["项目编号"],
    "field_a": "会议日期",
    "field_b": "开工日期",
    "aggregation": "none"
  },
  "check_expr": {
    "type": "cross_compare",
    "expr": "field_a <= field_b",
    "language": "python_eval"
  },
  "error_template": "第一次工地会议纪要日期 {field_a} 晚于开工日期 {field_b}（先开工后开会），监理工作未正式启动即开工",
  "severity_on_violation": "Sanity Check",
  "confirmation_required": true,
  "confirmation_scope": "both_parties_or_admin",
  "remediation": "核查第一次工地会议召开日期与工程开工日期的先后顺序",
  "status": "active",
  "source": "system",
  "version": "1.0.0",
  "created_at": "2026-07-30T10:00:00",
  "updated_at": "2026-07-30T10:00:00",
  "owner": "system",
  "applies_to": {
    "professional": ["*"],
    "subdivision_codes": []
  },
  "stats": {
    "total_hits": 0,
    "total_reviews": 0,
    "hit_rate": 0.0,
    "false_positive_count": 0,
    "false_positive_rate": 0.0,
    "last_hit_at": null,
    "last_review_at": null
  },
  "changelog": [
    {
      "version": "1.0.0",
      "date": "2026-07-30",
      "author": "system",
      "change": "从 logic-conflict-patterns.md 9.10.16 迁移"
    }
  ]
}
