{
  "rule_id": "IR-003",
  "name": "运算只审规",
  "level": "L1-IRON",
  "scope": "SINGLE_DOC",
  "category": "合规底线",
  "description": "运算审核只做规范性检查，不做数值复算。只检查：计算方法、参数取值、安全系数、边界条件、计算简图五个维度。",
  "trigger_when": {
    "doc_type": [
      "*"
    ],
    "field_required": []
  },
  "check_expr": {
    "type": "expression",
    "expr": "True",
    "language": "python_eval"
  },
  "error_template": "运算审核越界做了数值复算：{issue}",
  "severity_on_violation": "Fatal",
  "remediation": "仅做规范性检查（方法/参数/系数/边界/简图），不做数值复算",
  "status": "active",
  "source": "system",
  "version": "1.0.0",
  "created_at": "2026-07-30T10:00:00",
  "updated_at": "2026-07-30T10:00:00",
  "owner": "system",
  "applies_to": {
    "professional": [
      "*"
    ],
    "subdivision_codes": []
  },
  "stats": {
    "total_hits": 0,
    "total_reviews": 0,
    "hit_rate": 0.0,
    "false_positive_count": 0,
    "false_positive_rate": 0.0,
    "last_hit_at": null,
    "last_review_at": null
  },
  "alignment": null,
  "changelog": [
    {
      "version": "1.0.0",
      "date": "2026-07-30",
      "author": "system",
      "change": "从 SKILL.md 铁律 R-03 迁移"
    }
  ]
}