{
  "rule_id": "LG-104",
  "name": "监理通知单日期 ≤ 整改回复日期 ≤ 整改复核日期",
  "level": "L2-LOGIC",
  "scope": "CROSS_DOC",
  "category": "时间轴一致性",
  "description": "通知 → 整改 → 复核，闭环。矛盾表现：回复日期早于通知日期，或复核日期早于回复日期。",
  "trigger_when": {
    "doc_type": ["监理通知单", "整改回复单", "整改复核记录"],
    "field_required": ["日期", "通知单编号"]
  },
  "check_expr": {
    "type": "expression",
    "expr": "监理通知单日期 <= 整改回复日期 and 整改回复日期 <= 整改复核日期",
    "language": "python_eval"
  },
  "error_template": "时间轴矛盾：监理通知单 {通知单编号} 签发日期 {监理通知单日期}，整改回复日期 {整改回复日期}，复核日期 {整改复核日期}，顺序倒置",
  "severity_on_violation": "Sanity Check",
  "remediation": "核查整改流程是否倒签，或日期填错",
  "status": "active",
  "source": "system",
  "version": "1.0.0",
  "created_at": "2026-07-30T10:00:00",
  "updated_at": "2026-07-30T10:00:00",
  "owner": "system",
  "applies_to": {
    "professional": ["*"],
    "subdivision_codes": []
  },
  "stats": {
    "total_hits": 0,
    "total_reviews": 0,
    "hit_rate": 0.0,
    "false_positive_count": 0,
    "false_positive_rate": 0.0,
    "last_hit_at": null,
    "last_review_at": null
  },
  "alignment": null,
  "changelog": [
    {
      "version": "1.0.0",
      "date": "2026-07-30",
      "author": "system",
      "change": "从 logic-conflict-patterns.md 9.1.4 迁移"
    }
  ]
}
