{
  "rule_id": "IR-001",
  "name": "规范可追溯",
  "level": "L1-IRON",
  "scope": "SINGLE_DOC",
  "category": "合规底线",
  "description": "每条审核意见必须引用规范编号和条款号，不允许无规范依据的判定。所有规范通过 Obsidian 知识库或 references 缓存层实时查询，禁止凭记忆编造条文编号。",
  "trigger_when": {
    "doc_type": [
      "*"
    ],
    "field_required": []
  },
  "check_expr": {
    "type": "expression",
    "expr": "True",
    "language": "python_eval"
  },
  "error_template": "审核意见缺少规范引用：{issue}",
  "severity_on_violation": "Fatal",
  "remediation": "补充规范编号和条款号，必要时回源 Obsidian 原文确认",
  "status": "active",
  "source": "system",
  "version": "1.0.0",
  "created_at": "2026-07-30T10:00:00",
  "updated_at": "2026-07-30T10:00:00",
  "owner": "system",
  "applies_to": {
    "professional": [
      "*"
    ],
    "subdivision_codes": []
  },
  "stats": {
    "total_hits": 0,
    "total_reviews": 0,
    "hit_rate": 0.0,
    "false_positive_count": 0,
    "false_positive_rate": 0.0,
    "last_hit_at": null,
    "last_review_at": null
  },
  "alignment": null,
  "changelog": [
    {
      "version": "1.0.0",
      "date": "2026-07-30",
      "author": "system",
      "change": "从 SKILL.md 铁律 R-01 迁移"
    }
  ]
}