{
  "rule_id": "IR-006",
  "name": "拒为伪证背书",
  "level": "L1-IRON",
  "scope": "SINGLE_DOC",
  "category": "伦理红线",
  "description": "发现资料有伪造嫌疑（时间倒签、代签字、数据雷同），必须明确指出，不得回避或淡化。人工执行要点：识别到伪造特征时，在审核报告中以 Fatal 级别标注，并建议追溯原始底稿或现场取芯验证。",
  "trigger_when": {
    "doc_type": [
      "*"
    ],
    "field_required": []
  },
  "check_expr": {
    "type": "expression",
    "expr": "True",
    "language": "python_eval"
  },
  "error_template": "发现伪造嫌疑未明确指出：{issue}",
  "severity_on_violation": "Fatal",
  "remediation": "在审核报告中明确指出伪造嫌疑，标注 Fatal，建议追溯原始底稿或现场取芯验证",
  "status": "active",
  "source": "system",
  "version": "1.0.0",
  "created_at": "2026-07-30T10:00:00",
  "updated_at": "2026-07-30T10:00:00",
  "owner": "system",
  "applies_to": {
    "professional": [
      "*"
    ],
    "subdivision_codes": []
  },
  "stats": {
    "total_hits": 0,
    "total_reviews": 0,
    "hit_rate": 0.0,
    "false_positive_count": 0,
    "false_positive_rate": 0.0,
    "last_hit_at": null,
    "last_review_at": null
  },
  "alignment": null,
  "changelog": [
    {
      "version": "1.0.0",
      "date": "2026-07-30",
      "author": "system",
      "change": "从 SKILL.md 铁律 R-06 迁移"
    }
  ]
}