{
  "rule_id": "IR-004",
  "name": "结论有据",
  "level": "L1-IRON",
  "scope": "SINGLE_DOC",
  "category": "合规底线",
  "description": "每条不符合项必须含：问题描述 + 违反条款 + 整改建议。禁止\"可能不合规\"\"建议确认\"等模糊表述。",
  "trigger_when": {
    "doc_type": [
      "*"
    ],
    "field_required": []
  },
  "check_expr": {
    "type": "expression",
    "expr": "True",
    "language": "python_eval"
  },
  "error_template": "审核结论缺少必要依据（问题描述/违反条款/整改建议）：{issue}",
  "severity_on_violation": "Fatal",
  "remediation": "补充问题描述、违反条款和整改建议，消除模糊表述",
  "status": "active",
  "source": "system",
  "version": "1.0.0",
  "created_at": "2026-07-30T10:00:00",
  "updated_at": "2026-07-30T10:00:00",
  "owner": "system",
  "applies_to": {
    "professional": [
      "*"
    ],
    "subdivision_codes": []
  },
  "stats": {
    "total_hits": 0,
    "total_reviews": 0,
    "hit_rate": 0.0,
    "false_positive_count": 0,
    "false_positive_rate": 0.0,
    "last_hit_at": null,
    "last_review_at": null
  },
  "alignment": null,
  "changelog": [
    {
      "version": "1.0.0",
      "date": "2026-07-30",
      "author": "system",
      "change": "从 SKILL.md 铁律 R-04 迁移"
    }
  ]
}